{
  "bundle_hash": "sha256:6bec5d153df4df7ddf11decb8400804bbdec5ffb42c31691afb40d12fc16cdb5",
  "evaluator": {
    "name": "constitutional-cms",
    "version": "0.5.0"
  },
  "reason_codes": [
    "bundle_expired"
  ],
  "receipt_hash": "sha256:612ddc11a6400310d67b355d43567b1e4f55469ddafcc0a071ca1d4c894f0d47",
  "receipt_id": "cr_a9d94b672841533b",
  "schema_version": "ClaimReceiptV0_1",
  "superseded": false,
  "superseded_by": null,
  "valid_until": "2026-08-16T12:00:00Z",
  "verdict": "FAIL",
  "verified_at": "2026-08-16T12:00:00Z"
}
